### ISSUE TITLE
Calling _bulk_get endpoint with attachments=true panics if attachment is missing digest field

### ISSUE THREAD

**Issue by Macnificent** [couchbase/sync_gateway#2528]
### Sync Gateway version
Couchbase Sync Gateway/1.4.0(2;9e18d3e)

### Couchbase version 
4.5.0-2601 Enterprise Edition (build-2601

### Operating system
Ubuntu 14.04.4 LTS

### SG log configuration

```json
   "log":["*"],
   "verbose" : true,
   "pretty" : true,
```

### Tracing the problem

We've had a lot of issues with some users not being able to replicate certain documents, even though the documents are in their change feed (determined by looking at them in a browser). 

In an effort to resolve this problem, I spun up our app in the iOS simulator and started capturing all HTTP requests being sent. While looking through the request log, I noticed that some `_bulk_get` requests were resulting in connection errors.

I then replayed the failing requests and got the same result every time. In order to narrow down the problem I then took each id/rev pair and sent each of them separately. Doing this, it turned out that only some id/rev pairs caused the connection error. 

### SG log when performing _bulk_get request for a doc with a "corrupt" attachment

```
HTTP:  #8685: POST /redacted/_bulk_get?revs=true&attachments=true  (ADMIN)
```

Usually, this would be followed by:
```
HTTP+: #{RequestNum}:     --> 200   ({ResponseTime} ms)
```

But, for this call, there's no corresponding response, even with "log": ["*"].

### WireShark dump

(Omitting the initial handshake)

 | Source | Length | Info |
| ------------- | ------------- | ------------- |
 | Client | 551 | POST /redacted/_bulk_get?revs=true&attachments=true HTTP/1.1  (application/json)  |
 | SG | 60 | 4985 → 56248 [ACK] Seq=1 Ack=498 Win=30336 Len=0 |
 | SG | 60 | 4985 → 56248 [FIN, ACK] Seq=1 Ack=498 Win=30336 Len=0 |

As you can see, SG terminates the TCP connection by sending FIN/ACK

### The offending documents

The only thing the offending documents seem to have in common is this:

```json
{
  "_attachments": {
    "detail": {
      "revpos": 7,
      "stub": true
    }
  }
}
```

I have no idea how they ended up like this, but that's what it looks like when fetching the document.

When I create a new revision of the document which does not contain an `_attachments` key, the `_bulk_get` request (for the new revision) works fine. 

I'm not sure on how to proceed here. If instructed I could provide the sync meta data and attachment documents for the offending documents.

**Comment by Macnificent** [comment]
I'm noticing now that SG exhibits the same behaviour when calling /{db}/{doc_id}?open_revs=all when {doc_id} is the id of a document that has a "corrupt" attachment. Meaning that it also closes the TCP connection without logging anything to the log file.

### Wireshark dump

 | Source | Length | Info |
| ------------- | ------------- | ------------- |
 | Client | 383 | GET /redacted/{document_id}?open_revs=all |
 | SG | 60 | 4985 → 58312 [ACK] Seq=1 Ack=330 Win=30336 Len=0 |
 | SG | 60 | 4985 → 58312 [FIN, ACK] Seq=1 Ack=330 Win=30336 Len=0 |

**Comment by ajres** [comment]
First step would be to get a failing unit test for _bulk_get

**Comment by ajres** [comment]
Repro'd with [unit test](https://github.com/couchbase/sync_gateway/pull/2632), running SG with debugger attached.

**Comment by pkramerzoll** [comment]
What does "corrupt" attachment mean in this case? Is the attachment being corrupted by the SG after it is pushed from CBLite? We are experiencing this issue as well, but we are using the .NET CBLite.

Is there any work around at this point in time, either at the Sync Gateway or CBLite?

**Comment by Macnificent** [comment]
"Corrupt" in this case simply means that the attachments are missing several fields: `content_type`, `digest` and `length`. I'm not sure how or at which point the documents ended up like that. The only work-around I'm aware of is setting up a Couchbase view that checks for documents with a partial/corrupted `_attachments` field (i.e, missing the fields I mentioned above), and then creating new revisions of those documents that don't have that problem anymore. Brutish, I know, but that's what allowed the CBL replicator to continue syncing in my case.

**Comment by tleyden** [comment]
- [ ] When attachments in that state, just return error for that id in the bulk get
- [x] File a ticket to find out root cause of how this can happen - see https://github.com/couchbase/sync_gateway/issues/2762
