### ISSUE TITLE
Error processing DCP stream: EOF -- base.(*DCPReceiver).OnError() at dcp_feed.go

### ISSUE THREAD

**Issue by tleyden** [couchbase/sync_gateway#2514]
I'm sporadically seeing this error in the Sync Gateway logs:

```
2017-04-26T22:35:32.009-04:00 WARNING: Feed%!(EXTRA string=Error processing DCP stream: %v, 
*errors.errorString=pkt.Receive, err: read tcp 192.168.33.12:59982->192.168.33.10:11210: 
read: connection reset by peer) -- base.(*DCPReceiver).OnError() at dcp_feed.go:123
```

or this error: 

```
2017-05-02T19:51:11.947+01:00 WARNING: Error processing DCP stream: EOF
 -- base.(*DCPReceiver).OnError() at dcp_feed.go:123
```

Which is cbdatasource (go-couchbase) informing Sync Gateway that the DCP stream has been closed.  The DCP error happens almost immediately after Sync Gateway starts up and connects to multiple couchbase server buckets.  (so far, only reproducible when connecting to multiple buckets, from multiple sync gateway processes)

On the one hand, Sync Gateway might need to be updated to handle these more robustly, as outlined in [MB-24202](https://issues.couchbase.com/browse/MB-24202)

On the other hand, these errors indicate a possible bug in cbdatasource in the way it's using DCP.  

When working w/ @mcpaddy, it looks like couchbase server is closing it's end of the DCP connection, but at this point it's unclear as to why.  

Related issue: https://github.com/couchbase/sync_gateway/issues/2423#issuecomment-298765898

**Comment by tleyden** [comment]
Here is a run locally on virtualbox vm's that reproduced the issue with`./mcctl set verbosity debug` set:

- [cbcollect info output](https://s3.amazonaws.com/cb-customers/tleyden/collectinfo-2017-05-02T235328-ns_1%40192.168.33.10.zip) -- server logs
- [sg1 pcap -- this received the DCP EOF](http://cbmobile-logging.s3.amazonaws.com/packet-traces/sg_issue_2423/sg1_5.pcap) -- use this filter `tcp.port eq 41048` and note the couchbase server appears to close the connection in frame 8591
- [sg2 pcap -- including for completeness, can probably be ignored](http://cbmobile-logging.s3.amazonaws.com/packet-traces/sg_issue_2423/sg2_5.pcap) 
- [sg1 logs](https://gist.github.com/tleyden/279a004fdfe4ec8532d3c1bdf510afbb) 
- [mobile-testkit logs](https://gist.github.com/tleyden/e69768eb4719a73659adb10443e9231a)

<img width="1413" alt="screen shot 2017-05-03 at 11 37 11 am" src="https://cloud.githubusercontent.com/assets/296876/25675895/f129fe1a-2ff4-11e7-80da-b59bfa3926a5.png">


Note: the tcdump captures have a lot of missing packets, maybe due to running under virtualbox

**Comment by ajres** [comment]
I have only seen this locally on a fresh project using the extended build instructions, then:

`$ git checkout master`
  $ ./build.sh
  $ sync_gateway shadowtest-dcp.json

```
{
    "log": ["*"],
    "databases": {
        "db": {
	    "revs_limit":5,
            "server":"http://localhost:8091",
            "bucket":"bucket-1",
            "feedtype":"dcp",
            "shadow": {
               "server": "http://localhost:8091",
               "bucket":"shadow",
               "feedtype":"dcp"
            },
            "users": {
                "GUEST": {"disabled": false}
            },
            "event_handlers": {
                "document_changed": [
                    {
                        "handler":"webhook",
                        "url":"http://localhost:4985/db/"
                    }
                ]
            }
        }
    }
}
```

  I see the errors immediately in the console.

**Comment by tleyden** [comment]
I reproduced the issue using https://github.com/couchbase/go-couchbase/commit/4ec5a3f046b1b80735915ad5e9846d63e9191361, and I do see the Hello request in the pcap trace now:

```
Frame 3772: 107 bytes on wire (856 bits), 107 bytes captured (856 bits)
Ethernet II, Src: CadmusCo_86:7b:60 (08:00:27:86:7b:60), Dst: CadmusCo_4c:12:26 (08:00:27:4c:12:26)
Internet Protocol Version 4, Src: 192.168.33.11, Dst: 192.168.33.10
Transmission Control Protocol, Src Port: 49623 (49623), Dst Port: 11210 (11210), Seq: 77, Ack: 63, Len: 41
Couchbase Protocol, Hello Request, Opcode: 0x1f, VBucket: 0x0
    Magic: Request (0x80)
    Opcode: Hello (0x1f)
    Key Length: 13
    Extras Length: 0
    Data Type: Raw bytes (0x00)
    VBucket: 0 (0x0000)
    [Value Length: 4]
    Total Body Length: 17
    Opaque: 0x00000000
    CAS: 0x0000000000000000
    Key: cbdatasource-
    Value: 

```

however I'm not sure how to tell if xerror is enabled.

Collected files:

- [sync gateway pcap](http://cbmobile-logging.s3.amazonaws.com/packet-traces/sg_issue_2423/sg1_6.pcap) - use filter `tcp.port eq 49623`, connection closed in frame 4064
- [cb collectinfo](https://s3.amazonaws.com/cb-customers/tleyden/collectinfo-2017-05-03T082806-ns_1%40192.168.33.10.zip) - with `./mcctl set verbosity info`.   
- [sg logs](https://gist.github.com/tleyden/ddfb520a049c3c01ee12736627dfd7e6) 
- [mobile-testkit logs](https://gist.github.com/tleyden/21b7c11eff0fab9e41179c49a30c18d5)

**Comment by tleyden** [comment]
One more repro, this time with `./mcctl set verbosity debug`

- [sync gateway pcap](http://cbmobile-logging.s3.amazonaws.com/packet-traces/sg_issue_2423/sg1_7.pcap) -- use filter `tcp.port eq 49861`, connection closed in frame 4382
- [cb collectinfo](https://s3.amazonaws.com/cb-customers/tleyden/collectinfo-2017-05-03T085312-ns_1%40192.168.33.10.zip) 
- [sg logs](https://gist.github.com/tleyden/5558ce25ee9259704c2ab90c70208424)

**Comment by daverigby** [comment]
Example lifetime of one of your streams:

```
2017-05-03T04:50:39.880607-04:00 WARNING (data-bucket-1) DCP (Producer) eq_dcpq:cbdatasource-380704bb7b4d7c03 - (vb 0) stream created with start seqno 0 and end seqno 18446744073709551615
2017-05-03T04:50:39.880619-04:00 DEBUG (data-bucket-1) DCP (Producer) eq_dcpq:cbdatasource-380704bb7b4d7c03 - (vb 0) Transitioning from pending to backfilling
2017-05-03T04:50:39.880626-04:00 DEBUG (data-bucket-1) DCP (Producer) eq_dcpq:cbdatasource-380704bb7b4d7c03 - (vb 0) Transitioning from backfilling to in-memory
2017-05-03T04:50:39.965655-04:00 DEBUG (data-bucket-1) DCP (Producer) eq_dcpq:cbdatasource-380704bb7b4d7c03 - (vb 0) Transitioning from in-memory to dead
2017-05-03T04:50:39.965671-04:00 WARNING (data-bucket-1) DCP (Producer) eq_dcpq:cbdatasource-380704bb7b4d7c03 - (vb 0) Stream closing, 0 items sent from backfill phase, 0 items sent from memory phase, 0 was last seqno sent, reason: The stream closed early because the conn was disconnected
```

As far as I can tell, the bucket is virtually empty - it only has 6 items in it. As such, most of the vBuckets are empty. For example, vb:0 (from the above example) has zero items in it:

```
memcached stats vbucket-details
['cbstats', '-a', '127.0.0.1:11210', 'vbucket-details', '-b', '_admin', '-p', '2cbdd2a8265564558116e89cb5bd2d1a']

data-bucket-1

 vb_0:                     active
 vb_0:high_seqno:          0
 vb_0:num_items:           0
 vb_0:ops_create:          0
 vb_0:ops_delete:          0
 vb_0:ops_reject:          0
 vb_0:ops_update:          0
```

I don't believe any changes have been made in this area recently; I can only assume this is the latent behaviour if you attempt to connect to an empty vBucket - i.e. it'll disconnect after finding no data in the vBucket.

If you want us to try to improve this behaviour - i.e. stay connected and start sending data when some is added to the vBucket - please raise a `couchbase-bucket` MB on Jira.

**Comment by mcpaddy** [comment]
@daverigby Two questions, to better my understanding

1. Is the DCP stream that SG using not the same "type" as the ns_server replication one i.e continues? Does this mean with a empty bucket or a bucket with no mutations, ns_server has to keep opening the streams, that does not match the behaviour I have seen.

2. Does this mean the log message is misleading:

```
2017-05-03T04:50:39.965671-04:00 WARNING (data-bucket-1) DCP (Producer) eq_dcpq:cbdatasource-380704bb7b4d7c03 - (vb 0) Stream closing, 0 items sent from backfill phase, 0 items sent from memory phase, 0 was last seqno sent, reason: The stream closed early because the conn was disconnected
```

For example the dcp stream used by cbbackupmgr closes with this statement, when everything has been synced, should that not be the message here:

```
2017-05-04T19:00:40.214463+01:00 NOTICE (Prod) DCP (Producer) eq_dcpq:backup-Prod-94932-0 - (vb 17) Stream closing, sent until seqno 942 remaining items 0, reason: The stream ended due to all items being streamed
```

**Comment by tleyden** [comment]
@daverigby I was able to repro after adding 10K docs to the buckets via:

* `./cbworkloadgen -b data-bucket-1 -i 10000 -u Administrator`
* `./cbworkloadgen -b data-bucket-2 -i 10000 -u Administrator`

Here are the captures:

* [cbcollectinfo](https://s3.amazonaws.com/cb-customers/tleyden/collectinfo-2017-05-03T173754-ns_1%40192.168.33.10.zip)
* [sg1 pcap](http://cbmobile-logging.s3.amazonaws.com/packet-traces/sg_issue_2423/sg1_8.pcap) -- see `tcp.port eq 50095`
* [sg logs](https://gist.github.com/tleyden/33a45f4060bf14f8707c51c9036422b4)

**Comment by tleyden** [comment]
@mcpaddy I reproduced with Couchbase 4.6.1

- [cbcollectinfo](
https://s3.amazonaws.com/cb-customers/tleyden/collectinfo-2017-05-03T180111-ns_1%40192.168.33.10.zip)
- [sg logs](https://gist.github.com/tleyden/e9e0ef9da99413a172e26643e4e2859a)

and attempt #2, this time with more verbose memcached logging:

- [cbcollectinfo](https://s3.amazonaws.com/cb-customers/tleyden/collectinfo-2017-05-03T181025-ns_1%40192.168.33.10.zip) 
- [sg pcap](http://cbmobile-logging.s3.amazonaws.com/packet-traces/sg_issue_2423/sg2_9.pcap) -- `tcp.port eq 50173`
- [sg logs](https://gist.github.com/tleyden/ec2e52e8f269d0e552cf5d6b8d0280e1)

**Comment by daverigby** [comment]
> @daverigby I was able to repro after adding 10K docs to the buckets via:
> 
> ./cbworkloadgen -b data-bucket-1 -i 10000 -u Administrator
> ./cbworkloadgen -b data-bucket-2 -i 10000 -u Administrator

You probably still have at least one empty vBucket - even with 10k docs it's quote possible one vBuckt has nothing in it.

Check the `vbucket-details` section in stats.log; see if any of the vBuckets which you saw disconnecting have `curr_items` == 0.

**Comment by daverigby** [comment]
Just looked at the most recent pcap (9) - it's Sync Gateway which is closing the connection!

<img width="1570" alt="screen shot 2017-05-04 at 21 31 38" src="https://cloud.githubusercontent.com/assets/755459/25723730/24c10ff8-3111-11e7-90d6-9a31a63b9929.png">

Note how the source port is 50173, dest is 11120 (i.e client -> server).

I haven't checked the previous, but I expect they are the same.

(For reference, I just tested locally with a simple DCP client using pydcp; and that behaves fine with an empty bucket).

**Comment by tleyden** [comment]
From what I can tell it's a cbdatasource issue -- I just filed [MB-24237 - DCP stream names conflicting across different processes due to not seeding random number generator](https://issues.couchbase.com/browse/MB-24237)

**Comment by puneetakhouri** [comment]
Receiving a similar issue even now,
`WARNING: Error processing DCP stream - will attempt to restart/reconnect: worker connect, server: 172.17.0.2:11210, err: dial tcp 172.17.0.2:11210: getsockopt: operation timed out -- base.(*DCPReceiver).OnError() at dcp_feed.go:136`
So I have a CB Server with one bucket in it, my SG is configured to connect to it with Guest user enabled. I have some data which I am able to pull and display properly on two simultaneous devices. But then when I insert data from one device, it is successfully inserted and visible on the CB Server as well. But it is not replicated on the other device and the above logs are visible on the SG Console continuously. However, if I restart my SG after a minute or two, it pulls the changes and displays on the other device.
Am I missing some configuration?
Here is my sync configuration json below
`{
	"log": ["HTTP+"],
	"adminInterface": "127.0.0.1:4985",
	"interface": "0.0.0.0:4984",
	"maxHeartbeat": 10,
	"databases": {
		"puneet": {
			"import_docs": "continuous",
			"server": "http://192.168.99.100:8091",
			"username":"puneet",
			"password":"puneet",
			"bucket": "puneet", 
			"enable_shared_bucket_access": true,
			"feed_type": "DCP",
			"users": {
				"GUEST": {"disabled": false, "admin_channels": ["*"] }
			},
			"sync": function (doc, oldDoc) {
		                if (doc.owner) {
		                    channel(doc.owner);
		                }
		            }
		}
	}
}`

**Comment by adamcfraser** [comment]
@puneetakhouri I don't think your issue is related to this ticket - I think the 'operation timed out' error is different.

It does sound like your SG is dropped the server's DCP stream, but it's not clear from the description why that would be.  Can you log a new ticket with more details, including the full SG logs?

**Comment by HJrad** [comment]
@puneetakhouri  I see this issue quite often. I couldn't resolve it. Any ideas?

**Comment by puneetakhouri** [comment]
@HJrad --- Well to be honest I do not have any clue. Initially when I was checking it on my local deployment I was facing this issue. But when I started to deploy it on docker and push it on the VM, everything was working fine and as expected. I think my Mac was blocking this connection.

**Comment by maheshagodekere** [comment]
Seems like 172.17.0.2:11210 is a docker IP address and your sync gateway don't see that IP. Are you running Couchbase server in docker? Hence, you have  DCP stream error! Somehow Sync gateway received this IP from Couchebase server admin running in your docker.

I do encounter the same. Not sure how to solve this!

**Comment by tleyden** [comment]
@maheshagodekere can you create a new post on https://forums.couchbase.com/ for this?  I can definitely help on the networking between couchbase server and sg containers (and hopefully try to improve the docs along the way), but this ticket probably isn't the best place for it.
